{
  "$schema": "https://pedyc.dev/harness/policy.schema.json",
  "maxIterations": 3,
  "protectedPaths": [".github/", ".claude/", ".agents/", ".harness/", "scripts/"],
  "requiredChecks": ["harness:verify", "type-check", "test:unit", "build"],
  "forbiddenCommands": ["git reset --hard", "git checkout --", "npm publish"],
  "allowedAgentCommands": [],
  "allowedProductPaths": ["src/"],
  "agentTimeoutMs": 300000
}
